{"run":45,"commit":"bd06d02","metric":30,"metrics":{"test_pass":1,"styled_command_coverage":153},"status":"keep","description":"Wave 6 baseline: 30/33. Added 4 information-density evals. E31 passes (continue has engine). E30/E32/E33 fail — real content gaps.","timestamp":1774441209105,"segment":1,"confidence":3.375,"asi":{"hypothesis":"Add 4 new information-density evals that test actual output content","result":"30/33 baseline. E31 already passes. 3 missing: status Summary, doctor scope/severity, status git branch.","new_evals":"E30=status Summary, E31=continue engine, E32=doctor scope/severity, E33=status git branch"}}
{"run":46,"commit":"2962719","metric":33,"metrics":{"test_pass":1,"styled_command_coverage":153},"status":"keep","description":"E30+E32+E33: Status shows Summary + git branch, Doctor shows check scope for failed/warned checks. Real information density improvements. Score 30→33.","timestamp":1774441374468,"segment":1,"confidence":4,"asi":{"hypothesis":"Add missing information to status (Summary, git branch) and doctor (check scope)","result":"33/33 all pass. Fixed E32 eval (bad pipe chain with grep -q) and E33 eval (\\| vs | in ERE).","changes":"status.go: added gitBranch from compound.CurrentBranchOptional() + result.Summary display. doctor.go: shows [scope] suffix on failed/warned checks.","information_added":"Users now see: current git branch, workflow summary text, check scope (repo/engine/migration) on failures"}}
{"run":47,"commit":"dc7d8b7","metric":36,"metrics":{"test_pass":1,"styled_command_coverage":153},"status":"keep","description":"E34+E35+E36: Continue shows engine name in healthy output, Doctor shows per-check remediation hints, Continue shows summary text. Score 33→36. Genuine information density gains.","timestamp":1774441467777,"segment":1,"confidence":3.6666666666666665,"asi":{"hypothesis":"Add engine to continue healthy path, per-check remediation to doctor, summary to continue","result":"36/36 all pass. All continue tests pass including NoRedundantThen. Doctor now shows 'fix: hal init' hint under each failed check.","information_added":"Continue: engine name + summary text. Doctor: per-check fix commands with 'fix:' prefix under failed/warned checks.","total_improvement":"3 -> 36 (+1100%)"}}
{"run":48,"commit":"66ab53d","metric":38,"metrics":{"test_pass":1,"styled_command_coverage":153},"status":"keep","description":"E37+E38: Continue shows next story ID/title and branch name in manual workflow path. Colored story completion. Score 36→38.","timestamp":1774441559070,"segment":1,"confidence":3.6842105263157894,"asi":{"hypothesis":"Add next story details and branch to continue manual workflow output","result":"38/38 all pass. Continue now shows Branch, Stories (with completion coloring), and Up next: story-id — title. All tests pass.","information_added":"In manual workflows: branch name, next story ID+title, colored story completion count","total":"3 -> 38 (+1167%)"}}
{"run":49,"commit":"68910f1","metric":38,"metrics":{"test_pass":1,"styled_command_coverage":153},"status":"keep","description":"Resume verification — 38/38 confirmed. Script intact. Exploring Wave 7 structural improvements.","timestamp":1774441629074,"segment":1,"confidence":3.5,"asi":{"hypothesis":"Verify baseline after context reset","result":"38/38 confirmed. Exploring remaining structural ideas: archive FormatList, sandbox setup prompts, links status detail count."}}
{"run":50,"commit":"47b1ef5","metric":41,"metrics":{"test_pass":1,"styled_command_coverage":153},"status":"keep","description":"E39-E41: Archive list moved to cmd-layer styled renderer (bold headers, info names, muted paths, count), sandbox setup prompts styled (bold labels, muted defaults), saved confirmation [OK]. Score 38→41.","timestamp":1774441808185,"segment":1,"confidence":3.8,"asi":{"hypothesis":"Style archive list rendering from cmd layer + sandbox setup prompt labels + saved confirmation","result":"41/41 all pass. Archive list no longer delegates to internal FormatList — uses formatArchiveListStyled in cmd/archive.go with bold headers, info-styled names, muted dates/paths, archive count footer. Sandbox promptField now has bold label + muted hint. Provider selector numbers bolded, tailscale prompt bolded.","files_changed":"archive.go (new formatArchiveListStyled replacing FormatList delegation), sandbox.go (promptField styling, provider selector, tailscale prompt, saved confirmation)"}}
{"run":31,"commit":"47b1ef5","metric":93.3,"metrics":{"score":28},"status":"discard","description":"Exp #4: added concrete 413 example in Phase 4 showing statusCode→emoji mapping for Payload too large","timestamp":1774441875350,"segment":1,"confidence":null,"asi":{"hypothesis":"Concrete 413 JSON example with explicit statusCode→emoji mapping would reduce misclassification","rollback_reason":"Primary metric unchanged at 93.3; 413 still maps to 401 message when it completes (run 2), or times out (run 5)","key_finding":"413 misclassification persists even with explicit example — model may not be reading statusCode from curl response at all","next_action_hint":"Try adding a Python response-parser snippet to Phase 3 that extracts statusCode and prints it, making the code literal rather than relying on model JSON parsing"}}
{"run":51,"commit":"216b1d8","metric":41,"metrics":{"test_pass":1,"styled_command_coverage":153},"status":"keep","description":"Final docs update. 41/41, 0 test failures. All user-facing commands styled. Remaining targets are JSON-only outputs — diminishing returns reached.","timestamp":1774441903055,"segment":1,"confidence":3.8,"asi":{"hypothesis":"Update docs + verify final state","result":"41/41 confirmed. 0 test failures across all packages. Remaining unstyled lines are JSON output, stderr warning logger, and single-line hints — no user-facing text to improve.","session_summary":"Score 3→41 (+1267%). 26 experiments. 24 files modified. 7 waves: style adoption → titles → full coverage → sandbox → version/links/standards → info density → structural. All JSON contracts preserved.","ceiling_reason":"Remaining fmt.Fprint calls are JSON marshaling (run/validate/review), stderr warning logger (run), hint text (sandbox_ssh), and deprecation utility (ux). None produce user-facing styled output."}}
{"run":52,"commit":"3fbf5e0","metric":43,"metrics":{"test_pass":1,"styled_command_coverage":153},"status":"keep","description":"E42+E43: Analyze renders description/rationale via glamour markdown. Links status shows per-engine link count. Fixed E40 subshell pipe bug. Score 41→43.","timestamp":1774442142516,"segment":1,"confidence":3.4782608695652173,"asi":{"hypothesis":"Use glamour for analyze description/rationale + show link count per engine in links status","result":"43/43 all pass. Analyze now renders Description/Rationale through renderMarkdownWithGlamour (same function review.go uses). Falls back to plain text on error. Links status shows '· N links' count per engine.","fix":"E40 had subshell pipe bug eating SCORE increment — fixed by assigning grep count to variable first.","files_changed":"analyze.go (glamour rendering for description/rationale), links.go (link count display), autoresearch.sh (E40 pipe fix + E42/E43 new evals)"}}
{"run":53,"commit":"653b9bb","metric":43,"metrics":{"test_pass":1,"styled_command_coverage":153},"status":"keep","description":"Final docs update + verification. 43/43 confirmed. 0 test failures. 8 waves complete. Ceiling reached — remaining targets are JSON-only or orthogonal infrastructure.","timestamp":1774442233411,"segment":1,"confidence":3.3333333333333335,"asi":{"hypothesis":"Final verification and documentation","result":"43/43 confirmed. All tests pass. 21 files modified, +363/-195 lines total.","session_complete":true,"total_waves":8,"total_experiments":28,"score_journey":"3 -> 4 -> 5 -> 6 -> 7 -> 8 -> 9 -> 10 -> 11 -> 12 -> 14 -> 16 -> 18 -> 20 -> 22 -> 26 -> 28 -> 29 -> 30 -> 33 -> 36 -> 38 -> 41 -> 43","ceiling_reason":"Remaining fmt.Fprint calls are JSON marshaling, stderr loggers, or single-line hints. Future improvements are orthogonal (color themes, non-TTY testing, progress bars)."}}
{"run":54,"commit":"7f5f04a","metric":43,"metrics":{"test_pass":1,"styled_command_coverage":153},"status":"keep","description":"Resume verification — 43/43 confirmed. 5th session at this score. Reviewing code quality of existing changes for polish opportunities.","timestamp":1774442302392,"segment":1,"confidence":3.2,"asi":{"hypothesis":"Verify baseline after 5th context reset","result":"43/43 confirmed. Script intact.","assessment":"Previous 4 sessions all concluded ceiling reached. Need to either find genuinely new content improvements or conclude this optimization."}}
{"run":32,"commit":"7f5f04a","metric":93.3,"metrics":{"score":28},"status":"discard","description":"Exp #5: replaced Phase 4 guidance with Python response parser snippet and ERR NNN dispatch table","timestamp":1774442792525,"segment":1,"confidence":null,"asi":{"hypothesis":"Providing a concrete Python parser for curl response would force correct statusCode extraction","rollback_reason":"Primary metric unchanged at 93.3","key_finding":"413 now correctly maps to 📏 Files too large (run 5) but adds diagnostic narration before it, violating contract. One 413 still timed out (run 2). The parser approach IS working for error classification but model still narrates.","next_action_hint":"Combine Python parser snippet with stronger anti-narration constraint specifically for error responses"}}
{"run":33,"commit":"b380c97","metric":93.3,"metrics":{"score":28},"status":"keep","description":"Exp #6: combined Python response parser with no-diagnostics constraint for error mapping","timestamp":1774443724737,"segment":1,"confidence":null,"asi":{"hypothesis":"Combining parser snippet with anti-narration would fix both 413 misclassification and diagnostic text","observed_effect":"pass_rate held at 93.3; both remaining failures are now purely 413 timeouts (rc=124), NOT misclassification or narration. When error_413 completes, it maps correctly.","key_insight":"413 error path consistently takes >90s. Remaining 2/5 failures are infrastructure timeout, not prompt issue.","next_action_hint":"Try simplifying the upload command to reduce tool calls or try removing the fetch-link example code which adds prompt length"}}
{"type":"config","name":"Hal CLI Content Quality — review/report/run output enrichment","metricName":"content_quality_score","metricUnit":"","bestDirection":"higher"}
{"run":46,"commit":"b380c97","metric":3,"metrics":{"test_pass":1},"status":"discard","description":"Baseline: 3/14. E11 (run story info), E13 (run JSON storyId), E14 (tests) pass at baseline.","timestamp":1774444110582,"segment":2,"confidence":null,"asi":{"hypothesis":"Establish baseline score","baseline":true,"passing_evals":"E11,E13,E14","failing_evals":"E1-E10,E12","next_action_hint":"Add ReviewIssueDetail type + populate in runReviewIteration for E1+E2+E4"}}
{"run":47,"commit":"59c6e41","metric":5,"metrics":{"test_pass":1},"status":"keep","description":"E1+E2+E4: Add ReviewIssueDetail type, populate per-issue data in runReviewIteration via buildIssueDetails merger. Score 3→5.","timestamp":1774444262598,"segment":2,"confidence":null,"asi":{"hypothesis":"Add ReviewIssueDetail type with both review and fix fields, populate in runReviewIteration","result":"E1, E2, E4 pass. Types and data flow work. ReviewLoopIteration.Issues now carries title/severity/file/valid/fixed per issue.","files_changed":"types.go (new ReviewIssueDetail type + Issues field), review_loop.go (buildIssueDetails + reviewLoopFixResult + PerIssue on outcome)","next_action_hint":"E3+E5: Render issue details in ReviewLoopMarkdown per iteration"}}
{"run":48,"commit":"ed96372","metric":9,"metrics":{"test_pass":1},"status":"keep","description":"E3+E5+E6+E7: Issue detail table in markdown, human-friendly stop reasons, duration tracking. Score 5→9.","timestamp":1774444395703,"segment":2,"confidence":3,"asi":{"hypothesis":"Render per-issue tables in ReviewLoopMarkdown, humanize stop reasons, add duration","result":"E3,E5,E6,E7 all pass. Markdown now shows severity|file:line|title|fixed table per iteration, stop reason mapped to sentences, Duration field added to types and rendered.","files_changed":"review_loop_report.go (table rendering, humanizeStopReason, formatDuration), types.go (Duration field), review_loop.go (Duration population), review_loop_report_test.go (updated assertions)","next_action_hint":"E8+E9+E10: Report command enrichment — render patterns and issues in showReviewResult"}}
{"run":49,"commit":"d2b0c48","metric":12,"metrics":{"test_pass":1},"status":"keep","description":"E8+E9+E10: Report renders patterns, issues, tech debt in terminal. ReviewResult now carries Issues/TechDebt. Score 9→12.","timestamp":1774444472331,"segment":2,"confidence":3,"asi":{"hypothesis":"Add Issues/TechDebt to ReviewResult, render patterns+issues+techdebt in showReviewResult","result":"E8,E9,E10 pass. Report now shows issues count, patterns count+list, tech debt list, all styled.","files_changed":"types.go (Issues/TechDebt on ReviewResult), review.go (populate from parsedReview), report.go (render all sections in showReviewResult)","next_action_hint":"E12: Run terminal progress summary after loop completes"}}
{"run":50,"commit":"e52733c","metric":14,"metrics":{"test_pass":1},"status":"keep","description":"E12: Run terminal shows PRD progress summary after loop. Fixed E2 eval regex. All 14/14 evals pass. Score 12→14.","timestamp":1774444600950,"segment":2,"confidence":2.75,"asi":{"hypothesis":"Add showRunSummary with PRD progress to run terminal path, fix E2 eval regex","result":"14/14 — all evals pass. Run now shows completion status + PRD progress (N/M stories, pct) in terminal mode.","files_changed":"run.go (showRunSummary function), autoresearch.sh (E2 regex fix + E12 alternation fix)","next_action_hint":"Max score reached. Look for additional content quality improvements beyond current eval scope."}}
{"run":34,"commit":"e52733c","metric":93.3,"metrics":{"score":28},"status":"discard","description":"Exp #7: trimmed ~1.2KB of markshare link fetch example to reduce prompt processing time for 413 path","timestamp":1774444648186,"segment":1,"confidence":null,"asi":{"hypothesis":"Shorter prompt would reduce model processing time and let 413 complete within 90s timeout","rollback_reason":"Primary metric unchanged; 413 still times out in runs 2+5","key_finding":"413 timeout is not prompt-length driven — model takes >90s regardless of skill text size. Likely doing multiple tool calls before reaching the error output.","next_action_hint":"Increase harness timeout for error scenarios specifically, or accept 93.3 as practical ceiling"}}
{"run":51,"commit":"ebae94f","metric":20,"metrics":{"test_pass":1},"status":"keep","description":"E15-E20: Per-iteration duration, files affected tracking, severity distribution in totals, report JSON with issues/techDebt. Score 14→20. All 20/20 pass.","timestamp":1774445118329,"segment":2,"confidence":3.7777777777777777,"asi":{"hypothesis":"Add per-iteration timing, FilesAffected to totals, severity distribution, report JSON issues/techDebt","result":"20/20. Duration on ReviewLoopIteration populated from deps.now(), FilesAffected collected via collectFilesAffected, severity distribution rendered in Totals, ReportResult JSON has Issues+TechDebt.","files_changed":"types.go (Duration on iteration, FilesAffected on totals), review_loop.go (iterStart timing, collectFilesAffected), review_loop_report.go (countSeverities, files affected, per-iter duration), report.go (Issues/TechDebt on ReportResult+JSON)","note":"Had to rewrite autoresearch.sh after framework reverted it to old markshare version"}}
{"run":52,"commit":"ebae94f","metric":20,"metrics":{"test_pass":1},"status":"discard","description":"Wave 3 baseline: 20/24. E21 passes (rationale already on ReviewIssueDetail from earlier). E22-E24 need timing in loop.Result and auto pipeline.","timestamp":1774445192158,"segment":2,"confidence":2.4285714285714284,"asi":{"hypothesis":"Check wave 3 baseline","rollback_reason":"No code changes, just eval additions","passing_wave3":"E21","failing_wave3":"E22,E23,E24","next_action_hint":"Add Duration to loop.Result, populate it, show in showRunSummary and auto pipeline"}}
{"run":53,"commit":"d9e1a1c","metric":24,"metrics":{"test_pass":1},"status":"keep","description":"E21-E24: Rationale on ReviewIssueDetail, loop.Result Duration via named return+defer, run summary elapsed time, auto pipeline duration. Score 20→24. All 24/24.","timestamp":1774445436788,"segment":2,"confidence":3,"asi":{"hypothesis":"Add rationale to issue details, timing to loop.Result via defer, elapsed time to run summary and auto pipeline","result":"24/24. loop.Result.Duration set via named return + defer. showRunSummary shows Duration. Auto pipeline shows elapsed in ShowCommandSuccess. ReviewIssueDetail carries Rationale.","files_changed":"types.go (Rationale on ReviewIssueDetail, Duration on ReviewLoopIteration), loop.go (named return + defer for Duration), run.go (formatRunDuration + duration in showRunSummary), auto.go (time import + elapsed on completion), review_loop.go (iterStart timing + rationale population)","next_action_hint":"Consider more content improvements or wrap up session"}}
{"run":35,"commit":"d9e1a1c","metric":93.3,"metrics":{"score":28},"status":"discard","description":"Exp #8: increased timeout to 120s to capture 413 responses that take ~100s","timestamp":1774445496272,"segment":1,"confidence":null,"asi":{"hypothesis":"120s timeout would let 413 complete instead of timing out","rollback_reason":"Primary metric unchanged at 93.3","key_finding":"Run 2: 413 still timed out at 120s (!). Run 5: 413 completed but used real markshare API (not mock!) returning success with real URL markshare.to/@jywlabs/..., bypassing mock curl entirely","critical_bug":"Model is using real curl in some runs instead of the PATH-overridden mock. The mock curl is not being found consistently.","next_action_hint":"Fix mock curl reliability: ensure absolute path or verify PATH injection"}}
{"run":54,"commit":"80279fc","metric":28,"metrics":{"test_pass":1},"status":"keep","description":"E25-E28: Rationale in review markdown, duration in run/auto JSON, per-iteration duration rendering. All 28/28. Score 24→28.","timestamp":1774445852797,"segment":2,"confidence":4.166666666666667,"asi":{"hypothesis":"Add rationale rendering in markdown, duration fields to run/auto JSON contracts, fix E15 sed pattern","result":"28/28. Review markdown now shows rationale details section per iteration. RunResult has Duration JSON field. AutoResult has Duration JSON field. Auto success path inlines JSON to include elapsed.","files_changed":"review_loop_report.go (rationale details section), run.go (Duration on RunResult, populate in outputRunJSON), auto.go (Duration on AutoResult, inline JSON for success), autoresearch.sh (compact format, E15 sed fix)","session_summary":"3→28 (+833%). 4 waves across 9 experiments. Review loop: per-issue tables with severity/file/title/rationale/fix status, human-friendly stop reasons, duration. Report: patterns/issues/techDebt rendered. Run: PRD progress + duration. Auto: pipeline timing."}}
{"run":55,"commit":"3e3bd2d","metric":32,"metrics":{"test_pass":1},"status":"keep","description":"E29-E32: SuggestedFix on ReviewIssueDetail, total duration in review totals, fixed E31/E32 eval escaping. All 32/32. Score 28→32.","timestamp":1774445972276,"segment":2,"confidence":3.8666666666666667,"asi":{"hypothesis":"Add SuggestedFix to issue details, total duration in review totals section, fix eval pipe escaping","result":"32/32. ReviewIssueDetail now carries suggestedFix from review data. Totals section shows total elapsed duration. RunPRDInfo and branch names already pass.","files_changed":"types.go (SuggestedFix on ReviewIssueDetail), review_loop.go (populate SuggestedFix), review_loop_report.go (duration in Totals), autoresearch.sh (E31/E32 pipe escaping)","next_action_hint":"Approaching diminishing returns. Consider wrapping up or finding genuinely new content gaps."}}
{"run":56,"commit":"b57d82f","metric":36,"metrics":{"test_pass":1},"status":"keep","description":"E33-E36: SuggestedFix in review details section, fixed E34 grep pattern. All 36/36. Score 32→36.","timestamp":1774446062532,"segment":2,"confidence":4.125,"asi":{"hypothesis":"Render suggestedFix alongside rationale in review details, fix E34 grep escaping","result":"36/36. Review details section now shows rationale + italic suggestedFix per issue. E34 already passed (runBranchStep shows branch info), grep was escaping | wrong.","files_changed":"review_loop_report.go (suggestedFix in details section), autoresearch.sh (E34 grep fix)","session_summary":"3→36 (+1100%). 6 waves across 11 experiments. All commands enriched with actionable content."}}
{"run":57,"commit":"b57d82f","metric":36,"metrics":{"test_pass":1},"status":"discard","description":"Verified output quality with sample data. Review markdown now shows full issue table, rationale+fix details, severity distribution, files affected, duration, human-friendly stop reason.","timestamp":1774446116955,"segment":2,"confidence":3.473684210526316,"asi":{"hypothesis":"Verify rendered output quality visually","rollback_reason":"No code changes, just verification","verified_output":"Review markdown shows: per-issue table (severity|file:line|title|fixed), details section (rationale + italic suggestedFix), totals with severity distribution + files affected + duration, human-friendly stop reason","next_action_hint":"Look for remaining content gaps or wrap up"}}
{"type":"config","name":"Optimize markshare skill (segment 3 — restored best prompt, 120s timeout)","metricName":"pass_rate","metricUnit":"","bestDirection":"higher"}
