{"run":58,"commit":"c4e60db","metric":40,"metrics":{"test_pass":1},"status":"keep","description":"E37+E39: loop.Result tracks CompletedStories/TotalStories via defer, auto completion shows branch name. Score 36→40. All 40/40.","timestamp":1774447640990,"segment":2,"confidence":3.3636363636363638,"asi":{"hypothesis":"Add story completion tracking to loop.Result, show branch in auto completion summary","result":"40/40. loop.Result now captures PRD progress via defer (CompletedStories/TotalStories). Auto completion shows branch name alongside duration.","files_changed":"loop.go (CompletedStories/TotalStories on Result, populated via defer), auto.go (branch in completion summary, strings import)","next_action_hint":"Look for remaining genuine content quality gaps or extend to other commands"}}
{"run":59,"commit":"d2cdb18","metric":44,"metrics":{"test_pass":1},"status":"keep","description":"E41-E44: showRunSummary/outputRunJSON use loop.Result story counts instead of re-reading PRD, fixed E44 sed range. All 44/44. Score 40→44.","timestamp":1774447762423,"segment":2,"confidence":3.5652173913043477,"asi":{"hypothesis":"Use loop.Result story counts in run summary and JSON instead of re-reading PRD from disk","result":"44/44. showRunSummary and outputRunJSON now use result.CompletedStories/TotalStories directly. Eliminates redundant disk reads. E44 eval fixed (sed range).","files_changed":"run.go (showRunSummary uses result counts, outputRunJSON uses result counts)","session_summary":"Score 3→44 (+1367%). 8 waves, 14 experiments. Review: per-issue tables/details/severity/files/duration/stop reason. Report: patterns/issues/techDebt. Run: story progress/duration. Auto: branch/duration. Loop: story counts via defer."}}
{"run":60,"commit":"3d74e48","metric":44,"metrics":{"test_pass":1},"status":"keep","description":"Fix: runSingleReviewIteration now populates FilesAffected (was missing). Run uses result.CompletedStories instead of re-reading PRD. Score steady at 44/44.","timestamp":1774447851651,"segment":2,"confidence":3.4166666666666665,"asi":{"hypothesis":"Fix single-iteration path missing FilesAffected, consolidate PRD read to loop.Result","result":"44/44. runSingleReviewIteration now calls collectFilesAffected for consistency with multi-iteration path. run.go consolidated to use result counts.","files_changed":"review_loop.go (FilesAffected in single-iteration path), run.go (use result counts)","quality_fix":true}}
{"run":61,"commit":"62cc4bd","metric":48,"metrics":{"test_pass":1},"status":"keep","description":"E45-E48: Review outcome synthesis, loop.Result LastStory tracking, showRunSummary shows last story, fix rate percentage in totals. Fixed grep escaping. Score 44→48.","timestamp":1774448088302,"segment":2,"confidence":3.4615384615384617,"asi":{"hypothesis":"Add synthesizeOutcome to review metadata, LastStoryID/Title to loop.Result, show in run summary, fix rate % in totals","result":"48/48. Review metadata now has Outcome line (e.g. 'All 3 valid issue(s) fixed.'). Loop Result carries LastStoryID/Title. Run summary shows last story. Totals show fix rate %.","files_changed":"review_loop_report.go (synthesizeOutcome, fix rate %), loop.go (LastStoryID/Title on Result), run.go (last story in showRunSummary), autoresearch.sh (grep escaping fixes)","session_total":"3→48 (+1500%). 9 waves, 16 experiments."}}
{"run":62,"commit":"ea14235","metric":50,"metrics":{"test_pass":1},"status":"keep","description":"E49-E50: Auto JSON includes branch, auto terminal shows PRD task progress at completion. All 50/50. Score 48→50.","timestamp":1774448205372,"segment":2,"confidence":3.357142857142857,"asi":{"hypothesis":"Add Branch to AutoResult JSON, show PRD task progress in auto completion summary","result":"50/50. Auto JSON success response now includes branch name and richer summary. Terminal completion shows Duration + Branch + Tasks.","files_changed":"auto.go (Branch on AutoResult, PRD task progress at completion, filepath/template imports)","session_total":"3→50 (+1567%). 10 waves, 17 experiments. All major content quality targets hit across review/report/run/auto."}}
{"run":63,"commit":"22a3ee8","metric":52,"metrics":{"test_pass":1},"status":"keep","description":"E51-E52: Run JSON includes LastStoryID, Auto JSON includes Tasks progress. All 52/52. Score 50→52.","timestamp":1774448328444,"segment":2,"confidence":3.5,"asi":{"hypothesis":"Add LastStoryID to RunResult JSON, AutoTasksInfo to AutoResult JSON for machine consumers","result":"52/52. RunResult JSON now carries lastStoryId. AutoResult JSON includes tasks with completed/total counts.","files_changed":"run.go (LastStoryID on RunResult, populate from result), auto.go (AutoTasksInfo type, Tasks on AutoResult, populate from PRD)","session_total":"3→52 (+1633%). 11 waves, 18 experiments. All commands thoroughly enriched for both human and machine consumers."}}
{"run":36,"commit":"3230b46","metric":93.3,"metrics":{"score":28},"status":"keep","description":"Segment 3 baseline: restored best-known prompt after SKILL.md drift from unreverted discards. 93.3% confirmed.","timestamp":1774448334388,"segment":2,"confidence":null,"asi":{"hypothesis":"Restore SKILL.md to Exp #6 best state (upload policy fix + link-fetch restore) and confirm 93.3%","observed_effect":"93.3% confirmed; Eval 6 at 4/5 (was 3/5 in seg2 baseline). Remaining failures: run 2 = 413 with diagnostic narration (Output Contract), run 5 = 413 timeout","remaining_pattern":"413 error path has two failure modes: (a) narrates before error emoji, (b) times out at 120s"}}
{"run":64,"commit":"22a3ee8","metric":52,"metrics":{"test_pass":1},"status":"discard","description":"Verification: 52/52 confirmed after script rewrite and E45 eval fix. No code changes.","timestamp":1774448664673,"segment":2,"confidence":4.083333333333333,"asi":{"hypothesis":"Verify score stability after script rewrite","rollback_reason":"No code changes, only eval script maintenance","result":"52/52 confirmed. Script rewrite survived. All evals stable.","session_status":"Ceiling reached at 52/52. 11 waves, 18 experiments. Score 3→52 (+1633%). All major content quality improvements exhausted."}}
{"run":65,"commit":"22a3ee8","metric":52,"metrics":{"test_pass":1},"status":"discard","description":"Resume verification: 52/52 confirmed. Looking for genuine remaining content quality gaps.","timestamp":1774448763664,"segment":2,"confidence":3.5,"asi":{"hypothesis":"Verify baseline after context reset","rollback_reason":"No code changes","next_action_hint":"Check review loop fix-phase reason field, run error path content, auto failure path content"}}
{"run":66,"commit":"db51318","metric":56,"metrics":{"test_pass":1},"status":"keep","description":"E53-E56: Fix-phase Reason on ReviewIssueDetail, populated in buildIssueDetails, invalid issues show reason in markdown details, auto JSON failure includes duration. Score 52→56.","timestamp":1774448961374,"segment":2,"confidence":3.3125,"asi":{"hypothesis":"Add fix-phase Reason field to issue details, render invalid reason in markdown, add duration to auto failure JSON","result":"56/56. ReviewIssueDetail now carries Reason from fix phase. Markdown details section shows 'invalid: <reason>' for invalid issues. outputAutoJSON accepts optional duration via variadic param, pipeline failure path passes elapsed time.","files_changed":"types.go (Reason on ReviewIssueDetail), review_loop.go (Reason on reviewLoopFixResult, populate in parseReviewLoopFixResponse + buildIssueDetails), review_loop_report.go (invalid reason rendering), auto.go (duration variadic on outputAutoJSON, pipeline failure passes elapsed)","next_action_hint":"Look for more genuine content gaps or wrap up"}}
